{
  "schema_version": 1,
  "kind": "public-pair-tokenizer.v1",
  "scope_digest": "bbbbbbbbbbbbbbbbbbbbbbbbbbbbbbbbbbbbbbbbbbbbbbbbbbbbbbbbbbbbbbbb",
  "public_pairs": {
    "path": "pairs.json",
    "sha256": "aaaaaaaaaaaaaaaaaaaaaaaaaaaaaaaaaaaaaaaaaaaaaaaaaaaaaaaaaaaaaaaa"
  },
  "tokenizer": {
    "model": "Qwen/Qwen2.5-Coder-1.5B",
    "revision": "df3ce67c0e24480f20468b6ef2894622d69eb73b",
    "files": {
      "tokenizer.json": {
        "path": "tokenizer.json",
        "sha256": "aaaaaaaaaaaaaaaaaaaaaaaaaaaaaaaaaaaaaaaaaaaaaaaaaaaaaaaaaaaaaaaa"
      },
      "tokenizer_config.json": {
        "path": "tokenizer_config.json",
        "sha256": "aaaaaaaaaaaaaaaaaaaaaaaaaaaaaaaaaaaaaaaaaaaaaaaaaaaaaaaaaaaaaaaa"
      },
      "vocab.json": {
        "path": "vocab.json",
        "sha256": "aaaaaaaaaaaaaaaaaaaaaaaaaaaaaaaaaaaaaaaaaaaaaaaaaaaaaaaaaaaaaaaa"
      },
      "merges.txt": {
        "path": "merges.txt",
        "sha256": "aaaaaaaaaaaaaaaaaaaaaaaaaaaaaaaaaaaaaaaaaaaaaaaaaaaaaaaaaaaaaaaa"
      }
    }
  }
}
